{
  "version": 1,
  "id": "T-0001",
  "type": "implement",
  "title": "RM-001 메모 목록 화면 구현",
  "description": "목록 Composable + ViewModel + Repository 연결, 단위 테스트 포함",
  "roadmap_item_id": "RM-001",
  "status": "submitted",
  "priority": "P0",
  "depends_on": [],
  "dangerous": [],
  "claim": {
    "role": "worker",
    "agent": "implementation-worker",
    "token": "c7f3a91b2e84",
    "at": "2026-08-05T10:00:05+09:00"
  },
  "attempts": 1,
  "max_attempts": 3,
  "result": {
    "summary": "목록 화면·ViewModel·Repository 구현, 단위 테스트 3건 추가, assembleDebug 성공",
    "changed_files": [
      "app/src/main/java/com/siamakerlab/memo/ui/list/MemoListScreen.kt",
      "app/src/main/java/com/siamakerlab/memo/ui/list/MemoListViewModel.kt",
      "app/src/test/java/com/siamakerlab/memo/ui/list/MemoListViewModelTest.kt"
    ],
    "build_ok": true,
    "test_ok": true,
    "requested_status": "IMPLEMENTED",
    "evidence_ids": ["E-0001"],
    "submitted_at": "2026-08-05T11:30:00+09:00"
  },
  "created_at": "2026-08-05T09:59:00+09:00",
  "updated_at": "2026-08-05T11:30:00+09:00"
}
